{
  "schema_version": "1.0.0",
  "org_id": "org_acme",
  "plant_id": "plant_ghaziabad_1",
  "vertical": "generic",
  "updated_at": "2026-08-18T06:00:00Z",
  "nodes": [
    { "id": "plant_ghaziabad_1", "type": "Plant", "label": "Ghaziabad HT Plant" },
    { "id": "utilities", "type": "Department", "label": "Utilities" },
    { "id": "comp_house", "type": "Line", "label": "Compressor house" },
    { "id": "COMP2", "type": "Asset", "label": "Air Compressor 2" },
    { "id": "COMP1", "type": "Asset", "label": "Air Compressor 1" },
    { "id": "screw_compressor", "type": "AssetClass" },
    { "id": "utilities_lead", "type": "Role" },
    { "id": "mechanical_maint", "type": "Role" },
    {
      "id": "min_header_bar",
      "type": "Constraint",
      "label": "Isolation min header",
      "properties": { "metric": "header_bar", "unit": "bar", "band_low": 6.5 }
    },
    {
      "id": "never_shed_soak_quench",
      "type": "Constraint",
      "label": "Never shed soak/quench/Type III dwell",
      "properties": {
        "load_flexibility": "never_shed",
        "codes": ["soak", "quench", "type_iii_dwell", "loaded_cure"]
      }
    },
    {
      "id": "isolation_requires_standby",
      "type": "Constraint",
      "label": "Isolation requires standby",
      "properties": { "requires": "standby_asset", "metric": "header_bar" }
    },
    {
      "id": "validated_empty_setback",
      "type": "Constraint",
      "label": "Empty-chamber setback band only",
      "properties": {
        "empty_chamber_only": true,
        "formula_id": "furnace_setback_opt"
      }
    },
    {
      "id": "comp2_typical_sp",
      "type": "TypicalEnvelope",
      "label": "COMP2 specific power band",
      "properties": {
        "metric": "vs_typical_pct",
        "unit": "pct",
        "band_low": -5,
        "band_high": 8,
        "window": "8w_matched"
      }
    },
    {
      "id": "pb_comp_sp_inspect",
      "type": "Playbook",
      "label": "Screw compressor SP drift inspect",
      "properties": {
        "waste_category": 3,
        "template_id": "tmpl_comp_filter_inspect_v1",
        "trust_tier": "T1"
      }
    }
  ],
  "edges": [
    { "from": "plant_ghaziabad_1", "type": "CONTAINS", "to": "utilities" },
    { "from": "utilities", "type": "CONTAINS", "to": "comp_house" },
    { "from": "comp_house", "type": "CONTAINS", "to": "COMP2" },
    { "from": "comp_house", "type": "CONTAINS", "to": "COMP1" },
    { "from": "COMP2", "type": "INSTANCE_OF", "to": "screw_compressor" },
    { "from": "COMP2", "type": "OWNED_BY", "to": "utilities_lead" },
    { "from": "COMP2", "type": "OWNED_BY", "to": "mechanical_maint" },
    { "from": "COMP1", "type": "STANDBY_FOR", "to": "COMP2" },
    { "from": "COMP2", "type": "CONSTRAINED_BY", "to": "min_header_bar" },
    { "from": "screw_compressor", "type": "REMEDY_IN", "to": "pb_comp_sp_inspect" }
  ]
}
